13:14:26.356390 IP (tos 0x8, ttl  64, id 30919, offset 0, flags [none], length: 40) 149.156.99.9.22 > 149.156.99.182.1128: . [tcp sum ok] ack 1339 win 32768
13:14:26.356651 IP (tos 0x0, ttl 128, id 15795, offset 0, flags [DF], length: 60) 149.156.99.182.1128 > 149.156.99.9.22: P [tcp sum ok] 1339:1359(20) ack 2136 win 65127
13:13:34.874424 IP (tos 0x0, ttl  57, id 15119, offset 0, flags [DF], length: 44) 217.74.65.55.80 > 149.156.99.182.1096: S [tcp sum ok] 628266130:628266130(0) ack 1209407481 win 17520 
13:13:34.874821 IP (tos 0x0, ttl 128, id 14111, offset 0, flags [DF], length: 40) 149.156.99.182.1096 > 217.74.65.55.80: . [tcp sum ok] ack 1 win 65535
13:13:34.892791 IP (tos 0x0, ttl 128, id 14112, offset 0, flags [DF], length: 724) 149.156.99.182.65536 > 217.74.65.55.80: P 1:685(684) ack 1 win 65535
13:13:35.278346 arp who-has 149.156.99.89 tell 149.156.99.51
13:13:35.976915 IP (tos 0x0, ttl  51, id 0, offset 0, flags [DF], length: 48) 130.259.133.50.80 > 149.156.99.182.1118: S [tcp sum ok] 2438363353:2438363353(0) ack 3625569573 win 5840 
13:13:40.849502 IP (tos 0x0, ttl 128, id 14282, offset 0, flags [DF], length: 724) 149.156.99.182.1096 > 217.74.65.55.80: P 1:685(684) ack 1 win 65535
13:13:41.977473 IP (tos 0x0, ttl  51, id 0, offset 0, flags [DF], length: 48) 130.203.133.50.80 > 149.156.99.182.1118: S [tcp sum ok] 2438363353:2438363353(0) ack 3625569573 win 5840 
13:13:45.393437 IP (tos 0x0, ttl  57, id 31623, offset 0, flags [DF], length: 40) 217.74.64.234.80 > 149.156.99.182.1100: F [tcp sum ok] 420:420(0) ack 476 win 6432
13:13:45.393901 IP (tos 0x0, ttl 128, id 14423, offset 0, flags [DF], length: 40) 149.156.99.182.1100 > 217.74.64.234.80: . [tcp sum ok] ack 421 win 65116
13:67:46.493062 IP (tos 0x0, ttl   1, id 14453, offset 0, flags [none], length: 92) 149.156.99.182 > 216.239.59.104: icmp 72: echo request seq 256
25:13:46.493598 IP (tos 0xc0, ttl  64, id 21761, offset 0, flags [none], length: 140) 149.156.99.17 > 149.156.99.182: icmp 120: time exceeded in-transit
11:54:29.923296 IP (tos 0x0, ttl 128, id 17918, offset 0, flags [DF], length: 48) 149.156.99.122.1779 > 149.156.96.21.80: S [tcp sum ok] 3304858532:3304858532(0) win 65535 <mss 1460,nop,nop,sackOK>
11:54:29.923993 IP (tos 0x0, ttl  62, id 24729, offset 0, flags [DF], length: 48) 149.156.96.21.80 > 149.156.99.122.1779: S [tcp sum ok] 2183461638:2183461638(0) ack 3304858533 win 24820 <nop,nop,sackOK,mss 1460>
11:54:29.924321 IP (tos 0x0, ttl 128, id 17920, offset 0, flags [DF], length: 40) 149.156.99.122.1779 > 149.156.96.21.80: . [tcp sum ok] ack 1 win 65535
11:54:30.773019 IP (tos 0x0, ttl 128, id 17949, offset 0, flags [DF], length: 345) 149.156.99.122.1779 > 149.156.96.21.80: P 1:306(305) ack 1 win 65535
11:54:30.774071 IP (tos 0x0, ttl  62, id 24730, offset 0, flags [DF], length: 40) 149.156.96.21.80 > 149.156.99.122.1779: . [tcp sum ok] ack 306 win 24820
11:54:30.776646 IP (tos 0x0, ttl  62, id 24731, offset 0, flags [DF], length: 262) 149.156.96.21.80 > 149.156.99.122.1779: P 1:223(222) ack 306 win 24820
11:54:30.801699 IP (tos 0x0, ttl 128, id 17951, offset 0, flags [DF], length: 394) 149.156.99.122.1779 > 149.156.96.21.80: P 306:660(354) ack 223 win 65313
11:54:30.803122 IP (tos 0x0, ttl  62, id 24732, offset 0, flags [DF], length: 264) 149.156.96.21.80 > 149.156.99.122.1779: P 223:447(224) ack 660 win 24820
11:54:30.817089 IP (tos 0x0, ttl 128, id 17953, offset 0, flags [DF], length: 394) 149.156.99.122.1779 > 149.156.96.21.80: P 660:1014(354) ack 447 win 65089
11:54:30.818498 IP (tos 0x0, ttl  62, id 24733, offset 0, flags [DF], length: 264) 149.156.96.21.80 > 149.156.99.122.1779: P 447:671(224) ack 1014 win 24820
11:54:30.841872 IP (tos 0x0, ttl 128, id 17955, offset 0, flags [DF], length: 390) 149.156.99.122.1779 > 149.156.96.21.80: P 1014:1364(350) ack 671 win 64865
11:54:30.843360 IP (tos 0x0, ttl  62, id 24734, offset 0, flags [DF], length: 263) 149.156.96.21.80 > 149.156.99.122.1779: P 671:894(223) ack 1364 win 24820
11:54:30.853662 IP (tos 0x0, ttl 128, id 17957, offset 0, flags [DF], length: 391) 149.156.99.122.1779 > 149.156.96.21.80: P 1364:1715(351) ack 894 win 64642
11:54:30.855147 IP (tos 0x0, ttl  62, id 24735, offset 0, flags [DF], length: 263) 149.156.96.21.80 > 149.156.99.122.1779: P 894:1117(223) ack 1715 win 24820
11:54:30.909675 IP (tos 0x0, ttl 128, id 17959, offset 0, flags [DF], length: 48) 149.156.99.122.1780 > 149.156.96.21.80: S [tcp sum ok] 2905782405:2905782405(0) win 65535 <mss 1460,nop,nop,sackOK>
11:54:30.910392 IP (tos 0x0, ttl  62, id 24736, offset 0, flags [DF], length: 48) 149.156.96.21.80 > 149.156.99.122.1780: S [tcp sum ok] 2184161170:2184161170(0) ack 2905782406 win 24820 <nop,nop,sackOK,mss 1460>
11:54:30.910710 IP (tos 0x0, ttl 128, id 17961, offset 0, flags [DF], length: 40) 149.156.99.122.1780 > 149.156.96.21.80: . [tcp sum ok] ack 1 win 65535
11:54:30.911570 IP (tos 0x0, ttl 128, id 17962, offset 0, flags [DF], length: 393) 149.156.99.122.1780 > 149.156.96.21.80: P 1:354(353) ack 1 win 65535
11:54:30.912288 IP (tos 0x0, ttl  62, id 24737, offset 0, flags [DF], length: 40) 149.156.96.21.80 > 149.156.99.122.1780: . [tcp sum ok] ack 354 win 24820
11:54:30.913128 IP (tos 0x0, ttl  62, id 24738, offset 0, flags [DF], length: 263) 149.156.96.21.80 > 149.156.99.122.1780: P 1:224(223) ack 354 win 24820
11:54:31.070091 IP (tos 0x0, ttl 128, id 17966, offset 0, flags [DF], length: 40) 149.156.99.122.1780 > 149.156.96.21.80: . [tcp sum ok] ack 224 win 65312
11:54:31.070190 IP (tos 0x0, ttl 128, id 17967, offset 0, flags [DF], length: 40) 149.156.99.122.1779 > 149.156.96.21.80: . [tcp sum ok] ack 1117 win 64419
11:54:32.074570 IP (tos 0x0, ttl 128, id 18002, offset 0, flags [DF], length: 48) 149.156.99.122.1781 > 149.156.99.9.110: S [tcp sum ok] 512979714:512979714(0) win 65535 <mss 1460,nop,nop,sackOK>
11:54:32.074838 IP (tos 0x0, ttl  64, id 14677, offset 0, flags [none], length: 44) 149.156.99.9.110 > 149.156.99.122.1781: S [tcp sum ok] 3219058985:3219058985(0) ack 512979715 win 32768 <mss 1460>
11:54:32.075173 IP (tos 0x0, ttl 128, id 18003, offset 0, flags [DF], length: 40) 149.156.99.122.1781 > 149.156.99.9.110: . [tcp sum ok] ack 1 win 65535
11:54:32.083774 IP (tos 0x0, ttl 128, id 18018, offset 0, flags [DF], length: 48) 149.156.99.122.1782 > 217.74.64.236.995: S [tcp sum ok] 129629575:129629575(0) win 65535 <mss 1460,nop,nop,sackOK>
11:54:32.088460 IP (tos 0x0, ttl  57, id 33142, offset 0, flags [DF], length: 44) 217.74.64.236.995 > 149.156.99.122.1782: S [tcp sum ok] 3169148683:3169148683(0) ack 129629576 win 57344 <mss 1460>
11:54:32.088827 IP (tos 0x0, ttl 128, id 18019, offset 0, flags [DF], length: 40) 149.156.99.122.1782 > 217.74.64.236.995: . [tcp sum ok] ack 1 win 65535
11:54:32.090144 IP (tos 0x0, ttl 128, id 18022, offset 0, flags [DF], length: 160) 149.156.99.122.1782 > 217.74.64.236.995: P 1:121(120) ack 1 win 65535
11:54:32.099843 IP (tos 0x0, ttl  57, id 33163, offset 0, flags [DF], length: 986) 217.74.64.236.995 > 149.156.99.122.1782: P 1:947(946) ack 121 win 58400
11:54:32.104587 IP (tos 0x0, ttl 128, id 18025, offset 0, flags [DF], length: 238) 149.156.99.122.1782 > 217.74.64.236.995: P 121:319(198) ack 947 win 64589
11:54:32.118879 IP (tos 0x0, ttl  57, id 33231, offset 0, flags [DF], length: 99) 217.74.64.236.995 > 149.156.99.122.1782: P 947:1006(59) ack 319 win 58400
11:54:32.139166 IP (tos 0x0, ttl  64, id 14678, offset 0, flags [none], length: 53) 149.156.99.9.110 > 149.156.99.122.1781: P [tcp sum ok] 1:14(13) ack 1 win 32768
11:54:32.149041 IP (tos 0x0, ttl 128, id 18032, offset 0, flags [DF], length: 46) 149.156.99.122.1781 > 149.156.99.9.110: P [tcp sum ok] 1:7(6) ack 14 win 65522
11:54:32.151342 IP (tos 0x0, ttl  64, id 14679, offset 0, flags [none], length: 206) 149.156.99.9.110 > 149.156.99.122.1781: P 14:180(166) ack 7 win 32768
11:54:32.165780 IP (tos 0x0, ttl 128, id 18037, offset 0, flags [DF], length: 53) 149.156.99.122.1781 > 149.156.99.9.110: P [tcp sum ok] 7:20(13) ack 180 win 65356
11:54:32.174672 IP (tos 0x0, ttl  64, id 14680, offset 0, flags [none], length: 75) 149.156.99.9.110 > 149.156.99.122.1781: P [tcp sum ok] 180:215(35) ack 20 win 32768
11:54:32.181326 IP (tos 0x0, ttl 128, id 18042, offset 0, flags [DF], length: 56) 149.156.99.122.1781 > 149.156.99.9.110: P [tcp sum ok] 20:36(16) ack 215 win 65321
11:54:32.237103 IP (tos 0x0, ttl  64, id 14681, offset 0, flags [none], length: 40) 149.156.99.9.110 > 149.156.99.122.1781: . [tcp sum ok] ack 36 win 32768
11:54:32.247526 IP (tos 0x0, ttl  64, id 14682, offset 0, flags [none], length: 99) 149.156.99.9.110 > 149.156.99.122.1781: P 215:274(59) ack 36 win 32768
11:54:32.258742 IP (tos 0x0, ttl 128, id 18055, offset 0, flags [DF], length: 46) 149.156.99.122.1781 > 149.156.99.9.110: P [tcp sum ok] 36:42(6) ack 274 win 65262
11:54:32.259004 IP (tos 0x0, ttl  64, id 14683, offset 0, flags [none], length: 49) 149.156.99.9.110 > 149.156.99.122.1781: P [tcp sum ok] 274:283(9) ack 42 win 32768
11:54:32.273163 IP (tos 0x0, ttl 128, id 18058, offset 0, flags [DF], length: 40) 149.156.99.122.1782 > 217.74.64.236.995: . [tcp sum ok] ack 1006 win 64530
11:54:32.274223 IP (tos 0x0, ttl 128, id 18061, offset 0, flags [DF], length: 46) 149.156.99.122.1781 > 149.156.99.9.110: P [tcp sum ok] 42:48(6) ack 283 win 65253
11:54:32.279820 IP (tos 0x0, ttl  57, id 33811, offset 0, flags [DF], length: 146) 217.74.64.236.995 > 149.156.99.122.1782: P 1006:1112(106) ack 319 win 58400
11:54:32.280130 IP (tos 0x0, ttl  64, id 14684, offset 0, flags [none], length: 93) 149.156.99.9.110 > 149.156.99.122.1781: P 283:336(53) ack 48 win 32768
11:54:32.290152 IP (tos 0x0, ttl 128, id 18068, offset 0, flags [DF], length: 77) 149.156.99.122.1782 > 217.74.64.236.995: P [tcp sum ok] 319:356(37) ack 1112 win 64424
11:54:32.299993 IP (tos 0x0, ttl  57, id 33929, offset 0, flags [DF], length: 130) 217.74.64.236.995 > 149.156.99.122.1782: P 1112:1202(90) ack 356 win 58400
11:54:32.306942 IP (tos 0x0, ttl  64, id 14685, offset 0, flags [none], length: 40) 149.156.99.9.110 > 149.156.99.122.1781: F [tcp sum ok] 336:336(0) ack 48 win 32768
11:54:32.307404 IP (tos 0x0, ttl 128, id 18071, offset 0, flags [DF], length: 40) 149.156.99.122.1781 > 149.156.99.9.110: . [tcp sum ok] ack 337 win 65200
11:54:32.330085 IP (tos 0x0, ttl 128, id 18080, offset 0, flags [DF], length: 40) 149.156.99.122.1781 > 149.156.99.9.110: F [tcp sum ok] 48:48(0) ack 337 win 65200
11:54:32.330288 IP (tos 0x0, ttl  64, id 14686, offset 0, flags [none], length: 40) 149.156.99.9.110 > 149.156.99.122.1781: . [tcp sum ok] ack 49 win 32768
11:54:32.368756 IP (tos 0x0, ttl 128, id 18083, offset 0, flags [DF], length: 93) 149.156.99.122.1782 > 217.74.64.236.995: P 356:409(53) ack 1202 win 64334
11:54:32.374264 IP (tos 0x0, ttl  57, id 34282, offset 0, flags [DF], length: 114) 217.74.64.236.995 > 149.156.99.122.1782: P 1202:1276(74) ack 409 win 58400
11:54:32.383555 IP (tos 0x0, ttl 128, id 18088, offset 0, flags [DF], length: 93) 149.156.99.122.1782 > 217.74.64.236.995: P 409:462(53) ack 1276 win 64260
11:54:32.458858 IP (tos 0x0, ttl  57, id 34697, offset 0, flags [DF], length: 114) 217.74.64.236.995 > 149.156.99.122.1782: P 1276:1350(74) ack 462 win 58400
11:54:32.461962 IP (tos 0x0, ttl 128, id 18093, offset 0, flags [DF], length: 77) 149.156.99.122.1782 > 217.74.64.236.995: P [tcp sum ok] 462:499(37) ack 1350 win 64186
11:54:32.481801 IP (tos 0x0, ttl  57, id 34793, offset 0, flags [DF], length: 114) 217.74.64.236.995 > 149.156.99.122.1782: P 1350:1424(74) ack 499 win 58400
11:54:32.493504 IP (tos 0x0, ttl 128, id 18098, offset 0, flags [DF], length: 77) 149.156.99.122.1782 > 217.74.64.236.995: P [tcp sum ok] 499:536(37) ack 1424 win 64112
11:54:32.512179 IP (tos 0x0, ttl  57, id 34931, offset 0, flags [DF], length: 114) 217.74.64.236.995 > 149.156.99.122.1782: P 1424:1498(74) ack 536 win 58400
11:54:32.512589 IP (tos 0x0, ttl  57, id 34933, offset 0, flags [DF], length: 40) 217.74.64.236.995 > 149.156.99.122.1782: F [tcp sum ok] 1498:1498(0) ack 536 win 58400
11:54:32.512971 IP (tos 0x0, ttl 128, id 18099, offset 0, flags [DF], length: 40) 149.156.99.122.1782 > 217.74.64.236.995: . [tcp sum ok] ack 1499 win 65535
11:54:32.560527 IP (tos 0x0, ttl 128, id 18108, offset 0, flags [DF], length: 77) 149.156.99.122.1782 > 217.74.64.236.995: P [tcp sum ok] 536:573(37) ack 1499 win 65535
11:54:32.560889 IP (tos 0x0, ttl 128, id 18109, offset 0, flags [DF], length: 40) 149.156.99.122.1782 > 217.74.64.236.995: F [tcp sum ok] 573:573(0) ack 1499 win 65535
11:54:32.567736 IP (tos 0x0, ttl  57, id 35082, offset 0, flags [none], length: 40) 217.74.64.236.995 > 149.156.99.122.1782: R [tcp sum ok] 3169150182:3169150182(0) win 0
11:54:35.862580 IP (tos 0x0, ttl 128, id 18220, offset 0, flags [DF], length: 48) 149.156.99.122.1783 > 149.156.99.9.80: S [tcp sum ok] 303662141:303662141(0) win 65535 <mss 1460,nop,nop,sackOK>
11:54:35.862896 IP (tos 0x0, ttl  64, id 14687, offset 0, flags [none], length: 44) 149.156.99.9.80 > 149.156.99.122.1783: S [tcp sum ok] 3219697316:3219697316(0) ack 303662142 win 32768 <mss 1460>
11:54:35.863203 IP (tos 0x0, ttl 128, id 18221, offset 0, flags [DF], length: 40) 149.156.99.122.1783 > 149.156.99.9.80: . [tcp sum ok] ack 1 win 65535
11:54:35.865399 IP (tos 0x0, ttl 128, id 18223, offset 0, flags [DF], length: 424) 149.156.99.122.1783 > 149.156.99.9.80: P 1:385(384) ack 1 win 65535
11:54:35.889288 IP (tos 0x0, ttl  64, id 14688, offset 0, flags [none], length: 1500) 149.156.99.9.80 > 149.156.99.122.1783: P 1:1461(1460) ack 385 win 32768
11:54:35.889620 IP (tos 0x0, ttl  64, id 14689, offset 0, flags [none], length: 1500) 149.156.99.9.80 > 149.156.99.122.1783: P 1461:2921(1460) ack 385 win 32768
11:54:35.889868 IP (tos 0x0, ttl 128, id 18225, offset 0, flags [DF], length: 40) 149.156.99.122.1783 > 149.156.99.9.80: . [tcp sum ok] ack 2921 win 65535
11:54:35.890722 IP (tos 0x0, ttl  64, id 14690, offset 0, flags [none], length: 1500) 149.156.99.9.80 > 149.156.99.122.1783: . 2921:4381(1460) ack 385 win 32768
11:54:35.891022 IP (tos 0x0, ttl  64, id 14691, offset 0, flags [none], length: 1500) 149.156.99.9.80 > 149.156.99.122.1783: . 4381:5841(1460) ack 385 win 32768
11:54:35.891233 IP (tos 0x0, ttl 128, id 18226, offset 0, flags [DF], length: 40) 149.156.99.122.1783 > 149.156.99.9.80: . [tcp sum ok] ack 5841 win 65535
11:54:35.891258 IP (tos 0x0, ttl  64, id 14692, offset 0, flags [none], length: 506) 149.156.99.9.80 > 149.156.99.122.1783: P 5841:6307(466) ack 385 win 32768
11:54:36.008492 IP (tos 0x0, ttl 128, id 18227, offset 0, flags [DF], length: 48) 149.156.99.122.1784 > 216.239.59.104.80: S [tcp sum ok] 3375871580:3375871580(0) win 65535 <mss 1460,nop,nop,sackOK>
11:54:36.023523 IP (tos 0x0, ttl 128, id 18228, offset 0, flags [DF], length: 472) 149.156.99.122.1783 > 149.156.99.9.80: P 385:817(432) ack 6307 win 65069
11:54:36.025653 IP (tos 0x0, ttl  64, id 14693, offset 0, flags [none], length: 537) 149.156.99.9.80 > 149.156.99.122.1783: P 6307:6804(497) ack 817 win 32768
11:54:36.034478 IP (tos 0x0, ttl 128, id 18230, offset 0, flags [DF], length: 467) 149.156.99.122.1783 > 149.156.99.9.80: P 817:1244(427) ack 6804 win 64572
11:54:36.065098 IP (tos 0x0, ttl 241, id 15886, offset 0, flags [none], length: 44) 216.239.59.104.80 > 149.156.99.122.1784: S [tcp sum ok] 2213704445:2213704445(0) ack 3375871581 win 8190 <mss 1460>
11:54:36.065487 IP (tos 0x0, ttl 128, id 18232, offset 0, flags [DF], length: 40) 149.156.99.122.1784 > 216.239.59.104.80: . [tcp sum ok] ack 1 win 65535
11:54:36.074280 IP (tos 0x0, ttl 128, id 18233, offset 0, flags [DF], length: 484) 149.156.99.122.1784 > 216.239.59.104.80: P 1:445(444) ack 1 win 65535
11:54:36.087079 IP (tos 0x0, ttl  64, id 14694, offset 0, flags [none], length: 40) 149.156.99.9.80 > 149.156.99.122.1783: . [tcp sum ok] ack 1244 win 32768
11:54:36.119588 IP (tos 0x0, ttl 128, id 18234, offset 0, flags [DF], length: 48) 149.156.99.122.1785 > 149.156.99.9.80: S [tcp sum ok] 1986033107:1986033107(0) win 65535 <mss 1460,nop,nop,sackOK>
11:54:36.119904 IP (tos 0x0, ttl  64, id 14695, offset 0, flags [none], length: 44) 149.156.99.9.80 > 149.156.99.122.1785: S [tcp sum ok] 3219831486:3219831486(0) ack 1986033108 win 32768 <mss 1460>
11:54:36.120212 IP (tos 0x0, ttl 128, id 18235, offset 0, flags [DF], length: 40) 149.156.99.122.1785 > 149.156.99.9.80: . [tcp sum ok] ack 1 win 65535
11:54:36.122256 IP (tos 0x0, ttl  64, id 14696, offset 0, flags [none], length: 1500) 149.156.99.9.80 > 149.156.99.122.1783: P 6804:8264(1460) ack 1244 win 32768
11:54:36.122574 IP (tos 0x0, ttl  64, id 14697, offset 0, flags [none], length: 1500) 149.156.99.9.80 > 149.156.99.122.1783: P 8264:9724(1460) ack 1244 win 32768
11:54:36.122828 IP (tos 0x0, ttl 128, id 18237, offset 0, flags [DF], length: 40) 149.156.99.122.1783 > 149.156.99.9.80: . [tcp sum ok] ack 9724 win 65535
11:54:36.122856 IP (tos 0x0, ttl  64, id 14698, offset 0, flags [none], length: 1207) 149.156.99.9.80 > 149.156.99.122.1783: P 9724:10891(1167) ack 1244 win 32768
11:54:36.130924 IP (tos 0x0, ttl 241, id 37916, offset 0, flags [none], length: 40) 216.239.59.104.80 > 149.156.99.122.1784: . [tcp sum ok] ack 445 win 7746
11:54:36.131511 IP (tos 0x0, ttl  50, id 6689, offset 0, flags [none], length: 40) 216.239.59.104.80 > 149.156.99.122.1784: . [tcp sum ok] ack 445 win 6432
11:54:36.133464 IP (tos 0x0, ttl 128, id 18238, offset 0, flags [DF], length: 469) 149.156.99.122.1785 > 149.156.99.9.80: P 1:430(429) ack 1 win 65535
11:54:36.138346 IP (tos 0x0, ttl  64, id 14699, offset 0, flags [none], length: 904) 149.156.99.9.80 > 149.156.99.122.1785: P 1:865(864) ack 430 win 32768
11:54:36.162280 IP (tos 0x0, ttl 128, id 18240, offset 0, flags [DF], length: 472) 149.156.99.122.1783 > 149.156.99.9.80: P 1244:1676(432) ack 10891 win 64368
11:54:36.164854 IP (tos 0x0, ttl  64, id 14700, offset 0, flags [none], length: 537) 149.156.99.9.80 > 149.156.99.122.1783: P 10891:11388(497) ack 1676 win 32768
11:54:36.173159 IP (tos 0x0, ttl  50, id 6690, offset 0, flags [none], length: 214) 216.239.59.104.80 > 149.156.99.122.1784: P 1:175(174) ack 445 win 6432
11:54:36.260754 IP (tos 0x0, ttl 128, id 18251, offset 0, flags [DF], length: 478) 149.156.99.122.1785 > 149.156.99.9.80: P 430:868(438) ack 865 win 64671
11:54:36.263399 IP (tos 0x0, ttl 128, id 18253, offset 0, flags [DF], length: 471) 149.156.99.122.1783 > 149.156.99.9.80: P 1676:2107(431) ack 11388 win 65535
11:54:36.264352 IP (tos 0x0, ttl  64, id 14701, offset 0, flags [none], length: 1500) 149.156.99.9.80 > 149.156.99.122.1785: P 865:2325(1460) ack 868 win 32768
11:54:36.264661 IP (tos 0x0, ttl  64, id 14702, offset 0, flags [none], length: 333) 149.156.99.9.80 > 149.156.99.122.1785: P 2325:2618(293) ack 868 win 32768
11:54:36.264894 IP (tos 0x0, ttl 128, id 18255, offset 0, flags [DF], length: 40) 149.156.99.122.1785 > 149.156.99.9.80: . [tcp sum ok] ack 2618 win 65535
11:54:36.265920 IP (tos 0x0, ttl  64, id 14703, offset 0, flags [none], length: 1500) 149.156.99.9.80 > 149.156.99.122.1783: P 11388:12848(1460) ack 2107 win 32768
11:54:36.266224 IP (tos 0x0, ttl  64, id 14704, offset 0, flags [none], length: 165) 149.156.99.9.80 > 149.156.99.122.1783: P 12848:12973(125) ack 2107 win 32768
11:54:36.266450 IP (tos 0x0, ttl 128, id 18256, offset 0, flags [DF], length: 40) 149.156.99.122.1783 > 149.156.99.9.80: . [tcp sum ok] ack 12973 win 65535
11:54:36.300202 IP (tos 0x0, ttl 128, id 18257, offset 0, flags [DF], length: 318) 149.156.99.122.1785 > 149.156.99.9.80: P 868:1146(278) ack 2618 win 65535
11:54:36.304210 IP (tos 0x0, ttl  64, id 14705, offset 0, flags [none], length: 750) 149.156.99.9.80 > 149.156.99.122.1785: P 2618:3328(710) ack 1146 win 32768
11:54:36.319949 IP (tos 0x0, ttl 128, id 18259, offset 0, flags [DF], length: 40) 149.156.99.122.1784 > 216.239.59.104.80: . [tcp sum ok] ack 175 win 65361
11:54:36.345775 IP (tos 0x0, ttl 128, id 18260, offset 0, flags [DF], length: 322) 149.156.99.122.1783 > 149.156.99.9.80: P 2107:2389(282) ack 12973 win 65535
11:54:36.350230 IP (tos 0x0, ttl  64, id 14706, offset 0, flags [none], length: 1500) 149.156.99.9.80 > 149.156.99.122.1783: P 12973:14433(1460) ack 2389 win 32768
11:54:36.350582 IP (tos 0x0, ttl  64, id 14707, offset 0, flags [none], length: 1500) 149.156.99.9.80 > 149.156.99.122.1783: . 14433:15893(1460) ack 2389 win 32768
11:54:36.350832 IP (tos 0x0, ttl 128, id 18262, offset 0, flags [DF], length: 40) 149.156.99.122.1783 > 149.156.99.9.80: . [tcp sum ok] ack 15893 win 65535
11:54:36.350860 IP (tos 0x0, ttl  64, id 14708, offset 0, flags [none], length: 1500) 149.156.99.9.80 > 149.156.99.122.1783: P 15893:17353(1460) ack 2389 win 32768
11:54:36.351001 IP (tos 0x0, ttl  64, id 14709, offset 0, flags [none], length: 636) 149.156.99.9.80 > 149.156.99.122.1783: P 17353:17949(596) ack 2389 win 32768
11:54:36.351222 IP (tos 0x0, ttl 128, id 18263, offset 0, flags [DF], length: 40) 149.156.99.122.1783 > 149.156.99.9.80: . [tcp sum ok] ack 17949 win 65535
11:54:36.394949 IP (tos 0x0, ttl 128, id 18264, offset 0, flags [DF], length: 325) 149.156.99.122.1785 > 149.156.99.9.80: P 1146:1431(285) ack 3328 win 64825
11:54:36.398949 IP (tos 0x0, ttl  64, id 14710, offset 0, flags [none], length: 524) 149.156.99.9.80 > 149.156.99.122.1785: P 3328:3812(484) ack 1431 win 32768
11:54:36.430281 IP (tos 0x0, ttl 128, id 18266, offset 0, flags [DF], length: 324) 149.156.99.122.1783 > 149.156.99.9.80: P 2389:2673(284) ack 17949 win 65535
11:54:36.432918 IP (tos 0x0, ttl  64, id 14711, offset 0, flags [none], length: 530) 149.156.99.9.80 > 149.156.99.122.1783: P 17949:18439(490) ack 2673 win 32768
11:54:36.446373 IP (tos 0x0, ttl 128, id 18268, offset 0, flags [DF], length: 326) 149.156.99.122.1785 > 149.156.99.9.80: P 1431:1717(286) ack 3812 win 64341
11:54:36.448760 IP (tos 0x0, ttl  64, id 14712, offset 0, flags [none], length: 531) 149.156.99.9.80 > 149.156.99.122.1785: P 3812:4303(491) ack 1717 win 32768
11:54:36.495917 IP (tos 0x0, ttl 128, id 18270, offset 0, flags [DF], length: 48) 149.156.99.122.1786 > 217.115.198.135.8082: S [tcp sum ok] 688782731:688782731(0) win 65535 <mss 1460,nop,nop,sackOK>
11:54:36.499031 IP (tos 0x0, ttl 128, id 18272, offset 0, flags [DF], length: 323) 149.156.99.122.1783 > 149.156.99.9.80: P 2673:2956(283) ack 18439 win 65045
11:54:36.502369 IP (tos 0x0, ttl  64, id 14714, offset 0, flags [none], length: 521) 149.156.99.9.80 > 149.156.99.122.1783: P 18439:18920(481) ack 2956 win 32768
11:54:36.514159 IP (tos 0x0, ttl 128, id 18274, offset 0, flags [DF], length: 322) 149.156.99.122.1785 > 149.156.99.9.80: P 1717:1999(282) ack 4303 win 65535
11:54:36.518307 IP (tos 0x0, ttl  64, id 14715, offset 0, flags [none], length: 1500) 149.156.99.9.80 > 149.156.99.122.1785: P 4303:5763(1460) ack 1999 win 32768
11:54:36.518619 IP (tos 0x0, ttl  64, id 14716, offset 0, flags [none], length: 1007) 149.156.99.9.80 > 149.156.99.122.1785: P 5763:6730(967) ack 1999 win 32768
11:54:36.518857 IP (tos 0x0, ttl 128, id 18276, offset 0, flags [DF], length: 40) 149.156.99.122.1785 > 149.156.99.9.80: . [tcp sum ok] ack 6730 win 65535
11:54:36.532093 IP (tos 0x0, ttl 128, id 18277, offset 0, flags [DF], length: 325) 149.156.99.122.1783 > 149.156.99.9.80: P 2956:3241(285) ack 18920 win 64564
11:54:36.532888 IP (tos 0x0, ttl  53, id 0, offset 0, flags [DF], length: 40) 217.115.198.135.8082 > 149.156.99.122.1786: R [tcp sum ok] 0:0(0) ack 688782732 win 0
11:54:36.534746 IP (tos 0x0, ttl  64, id 14717, offset 0, flags [none], length: 1500) 149.156.99.9.80 > 149.156.99.122.1783: P 18920:20380(1460) ack 3241 win 32768
11:54:36.535070 IP (tos 0x0, ttl  64, id 14718, offset 0, flags [none], length: 1500) 149.156.99.9.80 > 149.156.99.122.1783: P 20380:21840(1460) ack 3241 win 32768
11:54:36.535309 IP (tos 0x0, ttl 128, id 18279, offset 0, flags [DF], length: 40) 149.156.99.122.1783 > 149.156.99.9.80: . [tcp sum ok] ack 21840 win 65535
11:54:36.535336 IP (tos 0x0, ttl  64, id 14719, offset 0, flags [none], length: 354) 149.156.99.9.80 > 149.156.99.122.1783: P 21840:22154(314) ack 3241 win 32768
11:54:36.566709 IP (tos 0x0, ttl 128, id 18280, offset 0, flags [DF], length: 320) 149.156.99.122.1785 > 149.156.99.9.80: P 1999:2279(280) ack 6730 win 65535
11:54:36.569700 IP (tos 0x0, ttl  64, id 14720, offset 0, flags [none], length: 1500) 149.156.99.9.80 > 149.156.99.122.1785: P 6730:8190(1460) ack 2279 win 32768
11:54:36.569996 IP (tos 0x0, ttl  64, id 14721, offset 0, flags [none], length: 1500) 149.156.99.9.80 > 149.156.99.122.1785: P 8190:9650(1460) ack 2279 win 32768
11:54:36.570241 IP (tos 0x0, ttl 128, id 18282, offset 0, flags [DF], length: 40) 149.156.99.122.1785 > 149.156.99.9.80: . [tcp sum ok] ack 9650 win 65535
11:54:36.570266 IP (tos 0x0, ttl  64, id 14722, offset 0, flags [none], length: 43) 149.156.99.9.80 > 149.156.99.122.1785: P [tcp sum ok] 9650:9653(3) ack 2279 win 32768
11:54:36.571202 IP (tos 0x0, ttl 128, id 18283, offset 0, flags [DF], length: 330) 149.156.99.122.1783 > 149.156.99.9.80: P 3241:3531(290) ack 22154 win 65221
11:54:36.573672 IP (tos 0x0, ttl  64, id 14723, offset 0, flags [none], length: 1500) 149.156.99.9.80 > 149.156.99.122.1783: P 22154:23614(1460) ack 3531 win 32768
11:54:36.574012 IP (tos 0x0, ttl  64, id 14724, offset 0, flags [none], length: 457) 149.156.99.9.80 > 149.156.99.122.1783: P 23614:24031(417) ack 3531 win 32768
11:54:36.574253 IP (tos 0x0, ttl 128, id 18285, offset 0, flags [DF], length: 40) 149.156.99.122.1783 > 149.156.99.9.80: . [tcp sum ok] ack 24031 win 65535
11:54:36.659838 IP (tos 0x0, ttl 128, id 18286, offset 0, flags [DF], length: 329) 149.156.99.122.1785 > 149.156.99.9.80: P 2279:2568(289) ack 9653 win 65532
11:54:36.662587 IP (tos 0x0, ttl  64, id 14725, offset 0, flags [none], length: 1500) 149.156.99.9.80 > 149.156.99.122.1785: P 9653:11113(1460) ack 2568 win 32768
11:54:36.662900 IP (tos 0x0, ttl  64, id 14726, offset 0, flags [none], length: 1500) 149.156.99.9.80 > 149.156.99.122.1785: . 11113:12573(1460) ack 2568 win 32768
11:54:36.663150 IP (tos 0x0, ttl 128, id 18288, offset 0, flags [DF], length: 40) 149.156.99.122.1785 > 149.156.99.9.80: . [tcp sum ok] ack 12573 win 65535
11:54:36.663177 IP (tos 0x0, ttl  64, id 14727, offset 0, flags [none], length: 1500) 149.156.99.9.80 > 149.156.99.122.1785: . 12573:14033(1460) ack 2568 win 32768
11:54:36.663340 IP (tos 0x0, ttl  64, id 14728, offset 0, flags [none], length: 1500) 149.156.99.9.80 > 149.156.99.122.1785: . 14033:15493(1460) ack 2568 win 32768
11:54:36.663589 IP (tos 0x0, ttl 128, id 18289, offset 0, flags [DF], length: 40) 149.156.99.122.1785 > 149.156.99.9.80: . [tcp sum ok] ack 15493 win 65535
11:54:36.663612 IP (tos 0x0, ttl  64, id 14729, offset 0, flags [none], length: 1500) 149.156.99.9.80 > 149.156.99.122.1785: P 15493:16953(1460) ack 2568 win 32768
11:54:36.663767 IP (tos 0x0, ttl  64, id 14730, offset 0, flags [none], length: 1500) 149.156.99.9.80 > 149.156.99.122.1785: P 16953:18413(1460) ack 2568 win 32768
11:54:36.663974 IP (tos 0x0, ttl 128, id 18290, offset 0, flags [DF], length: 40) 149.156.99.122.1785 > 149.156.99.9.80: . [tcp sum ok] ack 18413 win 65535
11:54:36.664012 IP (tos 0x0, ttl  64, id 14731, offset 0, flags [none], length: 1500) 149.156.99.9.80 > 149.156.99.122.1785: . 18413:19873(1460) ack 2568 win 32768
11:54:36.664168 IP (tos 0x0, ttl  64, id 14732, offset 0, flags [none], length: 1500) 149.156.99.9.80 > 149.156.99.122.1785: P 19873:21333(1460) ack 2568 win 32768
11:54:36.664351 IP (tos 0x0, ttl 128, id 18291, offset 0, flags [DF], length: 40) 149.156.99.122.1785 > 149.156.99.9.80: . [tcp sum ok] ack 21333 win 62615
11:54:36.664367 IP (tos 0x0, ttl  64, id 14733, offset 0, flags [none], length: 1500) 149.156.99.9.80 > 149.156.99.122.1785: . 21333:22793(1460) ack 2568 win 32768
11:54:36.664523 IP (tos 0x0, ttl  64, id 14734, offset 0, flags [none], length: 1500) 149.156.99.9.80 > 149.156.99.122.1785: P 22793:24253(1460) ack 2568 win 32768
11:54:36.664699 IP (tos 0x0, ttl 128, id 18292, offset 0, flags [DF], length: 40) 149.156.99.122.1785 > 149.156.99.9.80: . [tcp sum ok] ack 24253 win 59695
11:54:36.664713 IP (tos 0x0, ttl  64, id 14735, offset 0, flags [none], length: 1500) 149.156.99.9.80 > 149.156.99.122.1785: . 24253:25713(1460) ack 2568 win 32768
11:54:36.664852 IP (tos 0x0, ttl  64, id 14736, offset 0, flags [none], length: 1500) 149.156.99.9.80 > 149.156.99.122.1785: P 25713:27173(1460) ack 2568 win 32768
11:54:36.665028 IP (tos 0x0, ttl 128, id 18293, offset 0, flags [DF], length: 40) 149.156.99.122.1785 > 149.156.99.9.80: . [tcp sum ok] ack 27173 win 56775
11:54:36.665042 IP (tos 0x0, ttl  64, id 14737, offset 0, flags [none], length: 1500) 149.156.99.9.80 > 149.156.99.122.1785: . 27173:28633(1460) ack 2568 win 32768
11:54:36.665185 IP (tos 0x0, ttl  64, id 14738, offset 0, flags [none], length: 1500) 149.156.99.9.80 > 149.156.99.122.1785: . 28633:30093(1460) ack 2568 win 32768
11:54:36.665362 IP (tos 0x0, ttl 128, id 18294, offset 0, flags [DF], length: 40) 149.156.99.122.1785 > 149.156.99.9.80: . [tcp sum ok] ack 30093 win 53855
11:54:36.665375 IP (tos 0x0, ttl  64, id 14739, offset 0, flags [none], length: 1500) 149.156.99.9.80 > 149.156.99.122.1785: P 30093:31553(1460) ack 2568 win 32768
11:54:36.665509 IP (tos 0x0, ttl  64, id 14740, offset 0, flags [none], length: 1500) 149.156.99.9.80 > 149.156.99.122.1785: . 31553:33013(1460) ack 2568 win 32768
11:54:36.665684 IP (tos 0x0, ttl 128, id 18295, offset 0, flags [DF], length: 40) 149.156.99.122.1785 > 149.156.99.9.80: . [tcp sum ok] ack 33013 win 50935
11:54:36.665699 IP (tos 0x0, ttl  64, id 14741, offset 0, flags [none], length: 706) 149.156.99.9.80 > 149.156.99.122.1785: P 33013:33679(666) ack 2568 win 32768
11:54:36.669610 IP (tos 0x0, ttl 128, id 18296, offset 0, flags [DF], length: 334) 149.156.99.122.1783 > 149.156.99.9.80: P 3531:3825(294) ack 24031 win 65535
11:54:36.670586 IP (tos 0x0, ttl 128, id 18298, offset 0, flags [DF], length: 40) 149.156.99.122.1785 > 149.156.99.9.80: . [tcp sum ok] ack 33679 win 54029
11:54:36.673455 IP (tos 0x0, ttl  64, id 14742, offset 0, flags [none], length: 1500) 149.156.99.9.80 > 149.156.99.122.1783: P 24031:25491(1460) ack 3825 win 32768
11:54:36.673789 IP (tos 0x0, ttl  64, id 14743, offset 0, flags [none], length: 1500) 149.156.99.9.80 > 149.156.99.122.1783: . 25491:26951(1460) ack 3825 win 32768
11:54:36.674044 IP (tos 0x0, ttl 128, id 18299, offset 0, flags [DF], length: 40) 149.156.99.122.1783 > 149.156.99.9.80: . [tcp sum ok] ack 26951 win 65535
11:54:36.674074 IP (tos 0x0, ttl  64, id 14744, offset 0, flags [none], length: 1500) 149.156.99.9.80 > 149.156.99.122.1783: . 26951:28411(1460) ack 3825 win 32768
11:54:36.674229 IP (tos 0x0, ttl  64, id 14745, offset 0, flags [none], length: 1500) 149.156.99.9.80 > 149.156.99.122.1783: . 28411:29871(1460) ack 3825 win 32768
11:54:36.674462 IP (tos 0x0, ttl 128, id 18300, offset 0, flags [DF], length: 40) 149.156.99.122.1783 > 149.156.99.9.80: . [tcp sum ok] ack 29871 win 65535
11:54:36.674484 IP (tos 0x0, ttl  64, id 14746, offset 0, flags [none], length: 1500) 149.156.99.9.80 > 149.156.99.122.1783: P 29871:31331(1460) ack 3825 win 32768
11:54:36.674646 IP (tos 0x0, ttl  64, id 14747, offset 0, flags [none], length: 1500) 149.156.99.9.80 > 149.156.99.122.1783: P 31331:32791(1460) ack 3825 win 32768
11:54:36.674863 IP (tos 0x0, ttl 128, id 18301, offset 0, flags [DF], length: 40) 149.156.99.122.1783 > 149.156.99.9.80: . [tcp sum ok] ack 32791 win 65535
11:54:36.674904 IP (tos 0x0, ttl  64, id 14748, offset 0, flags [none], length: 1500) 149.156.99.9.80 > 149.156.99.122.1783: . 32791:34251(1460) ack 3825 win 32768
11:54:36.675062 IP (tos 0x0, ttl  64, id 14749, offset 0, flags [none], length: 1500) 149.156.99.9.80 > 149.156.99.122.1783: . 34251:35711(1460) ack 3825 win 32768
11:54:36.675255 IP (tos 0x0, ttl 128, id 18302, offset 0, flags [DF], length: 40) 149.156.99.122.1783 > 149.156.99.9.80: . [tcp sum ok] ack 35711 win 62615
11:54:36.675271 IP (tos 0x0, ttl  64, id 14750, offset 0, flags [none], length: 1500) 149.156.99.9.80 > 149.156.99.122.1783: P 35711:37171(1460) ack 3825 win 32768
11:54:36.675396 IP (tos 0x0, ttl  64, id 14751, offset 0, flags [none], length: 1500) 149.156.99.9.80 > 149.156.99.122.1783: . 37171:38631(1460) ack 3825 win 32768
11:54:36.675567 IP (tos 0x0, ttl 128, id 18303, offset 0, flags [DF], length: 40) 149.156.99.122.1783 > 149.156.99.9.80: . [tcp sum ok] ack 38631 win 59695
11:54:36.675590 IP (tos 0x0, ttl  64, id 14752, offset 0, flags [none], length: 1500) 149.156.99.9.80 > 149.156.99.122.1783: P 38631:40091(1460) ack 3825 win 32768
11:54:36.675716 IP (tos 0x0, ttl  64, id 14753, offset 0, flags [none], length: 1500) 149.156.99.9.80 > 149.156.99.122.1783: . 40091:41551(1460) ack 3825 win 32768
11:54:36.675888 IP (tos 0x0, ttl 128, id 18304, offset 0, flags [DF], length: 40) 149.156.99.122.1783 > 149.156.99.9.80: . [tcp sum ok] ack 41551 win 56775
11:54:36.675902 IP (tos 0x0, ttl  64, id 14754, offset 0, flags [none], length: 1500) 149.156.99.9.80 > 149.156.99.122.1783: P 41551:43011(1460) ack 3825 win 32768
11:54:36.676053 IP (tos 0x0, ttl  64, id 14755, offset 0, flags [none], length: 1500) 149.156.99.9.80 > 149.156.99.122.1783: . 43011:44471(1460) ack 3825 win 32768
11:54:36.676237 IP (tos 0x0, ttl 128, id 18305, offset 0, flags [DF], length: 40) 149.156.99.122.1783 > 149.156.99.9.80: . [tcp sum ok] ack 44471 win 53855
11:54:36.676251 IP (tos 0x0, ttl  64, id 14756, offset 0, flags [none], length: 1500) 149.156.99.9.80 > 149.156.99.122.1783: P 44471:45931(1460) ack 3825 win 32768
11:54:36.676390 IP (tos 0x0, ttl  64, id 14757, offset 0, flags [none], length: 1500) 149.156.99.9.80 > 149.156.99.122.1783: . 45931:47391(1460) ack 3825 win 32768
11:54:36.676568 IP (tos 0x0, ttl 128, id 18306, offset 0, flags [DF], length: 40) 149.156.99.122.1783 > 149.156.99.9.80: . [tcp sum ok] ack 47391 win 50935
11:54:36.676581 IP (tos 0x0, ttl  64, id 14758, offset 0, flags [none], length: 1500) 149.156.99.9.80 > 149.156.99.122.1783: P 47391:48851(1460) ack 3825 win 32768
11:54:36.676774 IP (tos 0x0, ttl  64, id 14759, offset 0, flags [none], length: 1500) 149.156.99.9.80 > 149.156.99.122.1783: . 48851:50311(1460) ack 3825 win 32768
11:54:36.676969 IP (tos 0x0, ttl 128, id 18307, offset 0, flags [DF], length: 40) 149.156.99.122.1783 > 149.156.99.9.80: . [tcp sum ok] ack 50311 win 48015
11:54:36.676986 IP (tos 0x0, ttl  64, id 14760, offset 0, flags [none], length: 1500) 149.156.99.9.80 > 149.156.99.122.1783: . 50311:51771(1460) ack 3825 win 32768
11:54:36.677112 IP (tos 0x0, ttl  64, id 14761, offset 0, flags [none], length: 1500) 149.156.99.9.80 > 149.156.99.122.1783: P 51771:53231(1460) ack 3825 win 32768
11:54:36.677286 IP (tos 0x0, ttl 128, id 18308, offset 0, flags [DF], length: 40) 149.156.99.122.1783 > 149.156.99.9.80: . [tcp sum ok] ack 53231 win 45095
11:54:36.677315 IP (tos 0x0, ttl  64, id 14762, offset 0, flags [none], length: 1500) 149.156.99.9.80 > 149.156.99.122.1783: . 53231:54691(1460) ack 3825 win 32768
11:54:36.677443 IP (tos 0x0, ttl  64, id 14763, offset 0, flags [none], length: 1500) 149.156.99.9.80 > 149.156.99.122.1783: P 54691:56151(1460) ack 3825 win 32768
11:54:36.677615 IP (tos 0x0, ttl 128, id 18309, offset 0, flags [DF], length: 40) 149.156.99.122.1783 > 149.156.99.9.80: . [tcp sum ok] ack 56151 win 42175
11:54:36.677629 IP (tos 0x0, ttl  64, id 14764, offset 0, flags [none], length: 1500) 149.156.99.9.80 > 149.156.99.122.1783: . 56151:57611(1460) ack 3825 win 32768
11:54:36.677755 IP (tos 0x0, ttl  64, id 14765, offset 0, flags [none], length: 1500) 149.156.99.9.80 > 149.156.99.122.1783: P 57611:59071(1460) ack 3825 win 32768
11:54:36.677926 IP (tos 0x0, ttl 128, id 18310, offset 0, flags [DF], length: 40) 149.156.99.122.1783 > 149.156.99.9.80: . [tcp sum ok] ack 59071 win 39255
11:54:36.677946 IP (tos 0x0, ttl  64, id 14766, offset 0, flags [none], length: 1500) 149.156.99.9.80 > 149.156.99.122.1783: . 59071:60531(1460) ack 3825 win 32768
11:54:36.678071 IP (tos 0x0, ttl  64, id 14767, offset 0, flags [none], length: 1500) 149.156.99.9.80 > 149.156.99.122.1783: P 60531:61991(1460) ack 3825 win 32768
11:54:36.678242 IP (tos 0x0, ttl 128, id 18311, offset 0, flags [DF], length: 40) 149.156.99.122.1783 > 149.156.99.9.80: . [tcp sum ok] ack 61991 win 36335
11:54:36.678256 IP (tos 0x0, ttl  64, id 14768, offset 0, flags [none], length: 1500) 149.156.99.9.80 > 149.156.99.122.1783: . 61991:63451(1460) ack 3825 win 32768
11:54:36.678380 IP (tos 0x0, ttl  64, id 14769, offset 0, flags [none], length: 1500) 149.156.99.9.80 > 149.156.99.122.1783: P 63451:64911(1460) ack 3825 win 32768
11:54:36.678556 IP (tos 0x0, ttl 128, id 18312, offset 0, flags [DF], length: 40) 149.156.99.122.1783 > 149.156.99.9.80: . [tcp sum ok] ack 64911 win 33415
11:54:36.678577 IP (tos 0x0, ttl  64, id 14770, offset 0, flags [none], length: 1500) 149.156.99.9.80 > 149.156.99.122.1783: . 64911:66371(1460) ack 3825 win 32768
11:54:36.678705 IP (tos 0x0, ttl  64, id 14771, offset 0, flags [none], length: 1500) 149.156.99.9.80 > 149.156.99.122.1783: . 66371:67831(1460) ack 3825 win 32768
11:54:36.678879 IP (tos 0x0, ttl 128, id 18313, offset 0, flags [DF], length: 40) 149.156.99.122.1783 > 149.156.99.9.80: . [tcp sum ok] ack 67831 win 30495
11:54:36.678894 IP (tos 0x0, ttl  64, id 14772, offset 0, flags [none], length: 1500) 149.156.99.9.80 > 149.156.99.122.1783: P 67831:69291(1460) ack 3825 win 32768
11:54:36.679022 IP (tos 0x0, ttl  64, id 14773, offset 0, flags [none], length: 1500) 149.156.99.9.80 > 149.156.99.122.1783: . 69291:70751(1460) ack 3825 win 32768
11:54:36.679208 IP (tos 0x0, ttl 128, id 18314, offset 0, flags [DF], length: 40) 149.156.99.122.1783 > 149.156.99.9.80: . [tcp sum ok] ack 70751 win 27575
11:54:36.679231 IP (tos 0x0, ttl  64, id 14774, offset 0, flags [none], length: 1500) 149.156.99.9.80 > 149.156.99.122.1783: P 70751:72211(1460) ack 3825 win 32768
11:54:36.679360 IP (tos 0x0, ttl  64, id 14775, offset 0, flags [none], length: 1500) 149.156.99.9.80 > 149.156.99.122.1783: . 72211:73671(1460) ack 3825 win 32768
11:54:36.679533 IP (tos 0x0, ttl 128, id 18315, offset 0, flags [DF], length: 40) 149.156.99.122.1783 > 149.156.99.9.80: . [tcp sum ok] ack 73671 win 24655
11:54:36.679545 IP (tos 0x0, ttl  64, id 14776, offset 0, flags [none], length: 1500) 149.156.99.9.80 > 149.156.99.122.1783: P 73671:75131(1460) ack 3825 win 32768
11:54:36.679670 IP (tos 0x0, ttl  64, id 14777, offset 0, flags [none], length: 1500) 149.156.99.9.80 > 149.156.99.122.1783: . 75131:76591(1460) ack 3825 win 32768
11:54:36.679843 IP (tos 0x0, ttl 128, id 18316, offset 0, flags [DF], length: 40) 149.156.99.122.1783 > 149.156.99.9.80: . [tcp sum ok] ack 76591 win 21735
11:54:36.679865 IP (tos 0x0, ttl  64, id 14778, offset 0, flags [none], length: 1500) 149.156.99.9.80 > 149.156.99.122.1783: P 76591:78051(1460) ack 3825 win 32768
11:54:36.679990 IP (tos 0x0, ttl  64, id 14779, offset 0, flags [none], length: 1500) 149.156.99.9.80 > 149.156.99.122.1783: . 78051:79511(1460) ack 3825 win 32768
11:54:36.680162 IP (tos 0x0, ttl 128, id 18317, offset 0, flags [DF], length: 40) 149.156.99.122.1783 > 149.156.99.9.80: . [tcp sum ok] ack 79511 win 18815
11:54:36.680177 IP (tos 0x0, ttl  64, id 14780, offset 0, flags [none], length: 1500) 149.156.99.9.80 > 149.156.99.122.1783: P 79511:80971(1460) ack 3825 win 32768
11:54:36.680302 IP (tos 0x0, ttl  64, id 14781, offset 0, flags [none], length: 1500) 149.156.99.9.80 > 149.156.99.122.1783: . 80971:82431(1460) ack 3825 win 32768
11:54:36.680473 IP (tos 0x0, ttl 128, id 18318, offset 0, flags [DF], length: 40) 149.156.99.122.1783 > 149.156.99.9.80: . [tcp sum ok] ack 82431 win 15895
11:54:36.680495 IP (tos 0x0, ttl  64, id 14782, offset 0, flags [none], length: 1500) 149.156.99.9.80 > 149.156.99.122.1783: P 82431:83891(1460) ack 3825 win 32768
11:54:36.680622 IP (tos 0x0, ttl  64, id 14783, offset 0, flags [none], length: 1500) 149.156.99.9.80 > 149.156.99.122.1783: . 83891:85351(1460) ack 3825 win 32768
11:54:36.680800 IP (tos 0x0, ttl 128, id 18319, offset 0, flags [DF], length: 40) 149.156.99.122.1783 > 149.156.99.9.80: . [tcp sum ok] ack 85351 win 12975
11:54:36.680813 IP (tos 0x0, ttl  64, id 14784, offset 0, flags [none], length: 1500) 149.156.99.9.80 > 149.156.99.122.1783: . 85351:86811(1460) ack 3825 win 32768
11:54:36.680938 IP (tos 0x0, ttl  64, id 14785, offset 0, flags [none], length: 1500) 149.156.99.9.80 > 149.156.99.122.1783: P 86811:88271(1460) ack 3825 win 32768
11:54:36.681110 IP (tos 0x0, ttl 128, id 18320, offset 0, flags [DF], length: 40) 149.156.99.122.1783 > 149.156.99.9.80: . [tcp sum ok] ack 88271 win 10055
11:54:36.681132 IP (tos 0x0, ttl  64, id 14786, offset 0, flags [none], length: 1500) 149.156.99.9.80 > 149.156.99.122.1783: . 88271:89731(1460) ack 3825 win 32768
11:54:36.681258 IP (tos 0x0, ttl  64, id 14787, offset 0, flags [none], length: 1500) 149.156.99.9.80 > 149.156.99.122.1783: P 89731:91191(1460) ack 3825 win 32768
11:54:36.681430 IP (tos 0x0, ttl 128, id 18321, offset 0, flags [DF], length: 40) 149.156.99.122.1783 > 149.156.99.9.80: . [tcp sum ok] ack 91191 win 7135
11:54:36.681443 IP (tos 0x0, ttl  64, id 14788, offset 0, flags [none], length: 1500) 149.156.99.9.80 > 149.156.99.122.1783: . 91191:92651(1460) ack 3825 win 32768
11:54:36.681566 IP (tos 0x0, ttl  64, id 14789, offset 0, flags [none], length: 1500) 149.156.99.9.80 > 149.156.99.122.1783: P 92651:94111(1460) ack 3825 win 32768
11:54:36.681742 IP (tos 0x0, ttl 128, id 18322, offset 0, flags [DF], length: 40) 149.156.99.122.1783 > 149.156.99.9.80: . [tcp sum ok] ack 94111 win 4215
11:54:36.681768 IP (tos 0x0, ttl  64, id 14790, offset 0, flags [none], length: 1500) 149.156.99.9.80 > 149.156.99.122.1783: . 94111:95571(1460) ack 3825 win 32768
11:54:36.681900 IP (tos 0x0, ttl  64, id 14791, offset 0, flags [none], length: 1500) 149.156.99.9.80 > 149.156.99.122.1783: P 95571:97031(1460) ack 3825 win 32768
11:54:36.682075 IP (tos 0x0, ttl 128, id 18323, offset 0, flags [DF], length: 40) 149.156.99.122.1783 > 149.156.99.9.80: . [tcp sum ok] ack 97031 win 1295
11:54:36.687762 IP (tos 0x0, ttl 128, id 18324, offset 0, flags [DF], length: 40) 149.156.99.122.1785 > 149.156.99.9.80: . [tcp sum ok] ack 33679 win 65535
11:54:36.711494 IP (tos 0x0, ttl 128, id 18341, offset 0, flags [DF], length: 40) 149.156.99.122.1783 > 149.156.99.9.80: . [tcp sum ok] ack 97031 win 5055
11:54:36.712370 IP (tos 0x0, ttl  64, id 14792, offset 0, flags [none], length: 1500) 149.156.99.9.80 > 149.156.99.122.1783: . 97031:98491(1460) ack 3825 win 32768
11:54:36.712598 IP (tos 0x0, ttl  64, id 14793, offset 0, flags [none], length: 1500) 149.156.99.9.80 > 149.156.99.122.1783: . 98491:99951(1460) ack 3825 win 32768
11:54:36.712794 IP (tos 0x0, ttl 128, id 18342, offset 0, flags [DF], length: 40) 149.156.99.122.1783 > 149.156.99.9.80: . [tcp sum ok] ack 99951 win 2135
11:54:36.712816 IP (tos 0x0, ttl  64, id 14794, offset 0, flags [none], length: 1500) 149.156.99.9.80 > 149.156.99.122.1783: . 99951:101411(1460) ack 3825 win 32768
11:54:36.717942 IP (tos 0x0, ttl 128, id 18347, offset 0, flags [DF], length: 40) 149.156.99.122.1783 > 149.156.99.9.80: . [tcp sum ok] ack 101411 win 61155
11:54:36.718815 IP (tos 0x0, ttl  64, id 14795, offset 0, flags [none], length: 1500) 149.156.99.9.80 > 149.156.99.122.1783: . 101411:102871(1460) ack 3825 win 32768
11:54:36.719070 IP (tos 0x0, ttl  64, id 14796, offset 0, flags [none], length: 1500) 149.156.99.9.80 > 149.156.99.122.1783: . 102871:104331(1460) ack 3825 win 32768
11:54:36.719266 IP (tos 0x0, ttl 128, id 18348, offset 0, flags [DF], length: 40) 149.156.99.122.1783 > 149.156.99.9.80: . [tcp sum ok] ack 104331 win 58235
11:54:36.719290 IP (tos 0x0, ttl  64, id 14797, offset 0, flags [none], length: 1500) 149.156.99.9.80 > 149.156.99.122.1783: . 104331:105791(1460) ack 3825 win 32768
11:54:36.719439 IP (tos 0x0, ttl  64, id 14798, offset 0, flags [none], length: 997) 149.156.99.9.80 > 149.156.99.122.1783: P 105791:106748(957) ack 3825 win 32768
11:54:36.719623 IP (tos 0x0, ttl 128, id 18349, offset 0, flags [DF], length: 40) 149.156.99.122.1783 > 149.156.99.9.80: . [tcp sum ok] ack 106748 win 55818
11:54:36.720811 IP (tos 0x0, ttl 128, id 18350, offset 0, flags [DF], length: 40) 149.156.99.122.1783 > 149.156.99.9.80: . [tcp sum ok] ack 106748 win 60198
11:54:36.721333 IP (tos 0x0, ttl 128, id 18351, offset 0, flags [DF], length: 40) 149.156.99.122.1783 > 149.156.99.9.80: . [tcp sum ok] ack 106748 win 65535
11:54:36.756725 IP (tos 0x0, ttl 128, id 18352, offset 0, flags [DF], length: 322) 149.156.99.122.1785 > 149.156.99.9.80: P 2568:2850(282) ack 33679 win 65535
11:54:36.759742 IP (tos 0x0, ttl  64, id 14799, offset 0, flags [none], length: 1500) 149.156.99.9.80 > 149.156.99.122.1785: P 33679:35139(1460) ack 2850 win 32768
11:54:36.760060 IP (tos 0x0, ttl  64, id 14800, offset 0, flags [none], length: 1130) 149.156.99.9.80 > 149.156.99.122.1785: P 35139:36229(1090) ack 2850 win 32768
11:54:36.760300 IP (tos 0x0, ttl 128, id 18354, offset 0, flags [DF], length: 40) 149.156.99.122.1785 > 149.156.99.9.80: . [tcp sum ok] ack 36229 win 65535
11:54:36.764584 IP (tos 0x0, ttl 128, id 18355, offset 0, flags [DF], length: 321) 149.156.99.122.1783 > 149.156.99.9.80: P 3825:4106(281) ack 106748 win 65535
11:54:36.767644 IP (tos 0x0, ttl  64, id 14801, offset 0, flags [none], length: 1500) 149.156.99.9.80 > 149.156.99.122.1783: P 106748:108208(1460) ack 4106 win 32768
11:54:36.767969 IP (tos 0x0, ttl  64, id 14802, offset 0, flags [none], length: 1500) 149.156.99.9.80 > 149.156.99.122.1783: P 108208:109668(1460) ack 4106 win 32768
11:54:36.768218 IP (tos 0x0, ttl 128, id 18357, offset 0, flags [DF], length: 40) 149.156.99.122.1783 > 149.156.99.9.80: . [tcp sum ok] ack 109668 win 65535
11:54:36.768246 IP (tos 0x0, ttl  64, id 14803, offset 0, flags [none], length: 1076) 149.156.99.9.80 > 149.156.99.122.1783: P 109668:110704(1036) ack 4106 win 32768
11:54:36.866948 IP (tos 0x0, ttl 128, id 18358, offset 0, flags [DF], length: 48) 149.156.99.122.1786 > 217.115.198.135.8082: S [tcp sum ok] 688782731:688782731(0) win 65535 <mss 1460,nop,nop,sackOK>
11:54:36.903072 IP (tos 0x0, ttl  53, id 0, offset 0, flags [DF], length: 40) 217.115.198.135.8082 > 149.156.99.122.1786: R [tcp sum ok] 0:0(0) ack 1 win 0
11:54:36.976187 IP (tos 0x0, ttl 128, id 18359, offset 0, flags [DF], length: 40) 149.156.99.122.1783 > 149.156.99.9.80: . [tcp sum ok] ack 110704 win 64499
11:54:37.413793 IP (tos 0x0, ttl 128, id 18370, offset 0, flags [DF], length: 48) 149.156.99.122.1786 > 217.115.198.135.8082: S [tcp sum ok] 688782731:688782731(0) win 65535 <mss 1460,nop,nop,sackOK>
11:54:37.449944 IP (tos 0x0, ttl  53, id 0, offset 0, flags [DF], length: 40) 217.115.198.135.8082 > 149.156.99.122.1786: R [tcp sum ok] 0:0(0) ack 1 win 0
11:54:44.890681 IP (tos 0x0, ttl 128, id 18599, offset 0, flags [DF], length: 48) 149.156.99.122.1787 > 149.156.195.60.22: S [tcp sum ok] 1644471961:1644471961(0) win 65535 <mss 1460,nop,nop,sackOK>
11:54:44.891685 IP (tos 0x0, ttl  62, id 46756, offset 0, flags [DF], length: 48) 149.156.195.60.22 > 149.156.99.122.1787: S [tcp sum ok] 3194309597:3194309597(0) ack 1644471962 win 24820 <nop,nop,sackOK,mss 1460>
11:54:44.892047 IP (tos 0x0, ttl 128, id 18600, offset 0, flags [DF], length: 40) 149.156.99.122.1787 > 149.156.195.60.22: . [tcp sum ok] ack 1 win 65535
11:54:44.897088 IP (tos 0x0, ttl  62, id 46757, offset 0, flags [DF], length: 48) 149.156.195.60.38665 > 149.156.99.122.113: S [tcp sum ok] 3194393701:3194393701(0) win 24820 <nop,nop,sackOK,mss 1460>
11:54:45.891568 IP (tos 0x0, ttl  62, id 46758, offset 0, flags [DF], length: 40) 149.156.195.60.38665 > 149.156.99.122.113: R [tcp sum ok] 3194393702:3194393702(0) win 24820
11:54:45.892000 IP (tos 0x0, ttl  62, id 46759, offset 0, flags [DF], length: 65) 149.156.195.60.22 > 149.156.99.122.1787: P [tcp sum ok] 1:26(25) ack 1 win 24820
11:54:45.892959 IP (tos 0x0, ttl 128, id 18629, offset 0, flags [DF], length: 67) 149.156.99.122.1787 > 149.156.195.60.22: P [tcp sum ok] 1:28(27) ack 26 win 65510
11:54:45.893484 IP (tos 0x0, ttl  62, id 46760, offset 0, flags [DF], length: 40) 149.156.195.60.22 > 149.156.99.122.1787: . [tcp sum ok] ack 28 win 24820
11:54:45.896636 IP (tos 0x0, ttl  62, id 46761, offset 0, flags [DF], length: 316) 149.156.195.60.22 > 149.156.99.122.1787: P 26:302(276) ack 28 win 24820
11:54:45.915309 IP (tos 0x0, ttl 128, id 18630, offset 0, flags [DF], length: 196) 149.156.99.122.1787 > 149.156.195.60.22: P 28:184(156) ack 302 win 65234
11:54:45.929073 IP (tos 0x0, ttl  62, id 46762, offset 0, flags [DF], length: 52) 149.156.195.60.22 > 149.156.99.122.1787: P [tcp sum ok] 302:314(12) ack 184 win 24820
11:54:46.054068 IP (tos 0x0, ttl 128, id 18631, offset 0, flags [DF], length: 40) 149.156.99.122.1787 > 149.156.195.60.22: . [tcp sum ok] ack 314 win 65222
11:54:47.180024 IP (tos 0x0, ttl  62, id 24739, offset 0, flags [DF], length: 40) 149.156.96.21.80 > 149.156.99.122.1780: F [tcp sum ok] 224:224(0) ack 354 win 24820
11:54:47.180511 IP (tos 0x0, ttl 128, id 18662, offset 0, flags [DF], length: 40) 149.156.99.122.1780 > 149.156.96.21.80: . [tcp sum ok] ack 225 win 65312
11:54:47.180555 IP (tos 0x0, ttl  62, id 24740, offset 0, flags [DF], length: 40) 149.156.96.21.80 > 149.156.99.122.1779: F [tcp sum ok] 1117:1117(0) ack 1715 win 24820
11:54:47.180890 IP (tos 0x0, ttl 128, id 18663, offset 0, flags [DF], length: 40) 149.156.99.122.1779 > 149.156.96.21.80: . [tcp sum ok] ack 1118 win 64419
11:54:47.445344 IP (tos 0x0, ttl 128, id 18672, offset 0, flags [DF], length: 40) 149.156.99.122.1779 > 149.156.96.21.80: R [tcp sum ok] 1715:1715(0) ack 1118 win 0
11:54:47.447067 IP (tos 0x0, ttl 128, id 18673, offset 0, flags [DF], length: 40) 149.156.99.122.1780 > 149.156.96.21.80: R [tcp sum ok] 354:354(0) ack 225 win 0
11:54:48.209929 IP (tos 0x0, ttl 128, id 18702, offset 0, flags [DF], length: 60) 149.156.99.122.1787 > 149.156.195.60.22: P [tcp sum ok] 184:204(20) ack 314 win 65222
11:54:48.213193 IP (tos 0x0, ttl  62, id 46763, offset 0, flags [DF], length: 52) 149.156.195.60.22 > 149.156.99.122.1787: P [tcp sum ok] 314:326(12) ack 204 win 24820
11:54:48.350870 IP (tos 0x0, ttl 128, id 18703, offset 0, flags [DF], length: 40) 149.156.99.122.1787 > 149.156.195.60.22: . [tcp sum ok] ack 326 win 65210
11:54:51.755515 IP (tos 0x0, ttl  64, id 14804, offset 0, flags [none], length: 40) 149.156.99.9.80 > 149.156.99.122.1785: F [tcp sum ok] 36229:36229(0) ack 2850 win 32768
11:54:51.756017 IP (tos 0x0, ttl 128, id 18792, offset 0, flags [DF], length: 40) 149.156.99.122.1785 > 149.156.99.9.80: . [tcp sum ok] ack 36230 win 65535
11:54:51.765485 IP (tos 0x0, ttl  64, id 14805, offset 0, flags [none], length: 40) 149.156.99.9.80 > 149.156.99.122.1783: F [tcp sum ok] 110704:110704(0) ack 4106 win 32768
11:54:51.765928 IP (tos 0x0, ttl 128, id 18793, offset 0, flags [DF], length: 40) 149.156.99.122.1783 > 149.156.99.9.80: . [tcp sum ok] ack 110705 win 64499
11:54:52.444914 IP (tos 0x0, ttl 128, id 18818, offset 0, flags [DF], length: 40) 149.156.99.122.1785 > 149.156.99.9.80: R [tcp sum ok] 2850:2850(0) ack 36230 win 0
11:54:52.446644 IP (tos 0x0, ttl 128, id 18819, offset 0, flags [DF], length: 40) 149.156.99.122.1783 > 149.156.99.9.80: R [tcp sum ok] 4106:4106(0) ack 110705 win 0
11:54:54.823732 IP (tos 0x0, ttl 128, id 18898, offset 0, flags [DF], length: 440) 149.156.99.122.1787 > 149.156.195.60.22: P 204:604(400) ack 326 win 65210
11:54:54.826428 IP (tos 0x0, ttl  62, id 46764, offset 0, flags [DF], length: 52) 149.156.195.60.22 > 149.156.99.122.1787: P [tcp sum ok] 326:338(12) ack 604 win 24820
11:54:55.022581 IP (tos 0x0, ttl 128, id 18899, offset 0, flags [DF], length: 40) 149.156.99.122.1787 > 149.156.195.60.22: . [tcp sum ok] ack 338 win 65198
11:54:57.305012 IP (tos 0x0, ttl 128, id 18964, offset 0, flags [DF], length: 48) 149.156.99.122.1049 > 217.17.41.85.443: P [tcp sum ok] 2229694305:2229694313(8) ack 3498108034 win 65407
11:54:57.310716 IP (tos 0x0, ttl  56, id 62003, offset 0, flags [DF], length: 40) 217.17.41.85.443 > 149.156.99.122.1049: . [tcp sum ok] ack 8 win 5840
11:55:00.993592 IP (tos 0x0, ttl 128, id 19069, offset 0, flags [DF], length: 440) 149.156.99.122.1787 > 149.156.195.60.22: P 604:1004(400) ack 338 win 65198
11:55:00.995969 IP (tos 0x0, ttl  62, id 46765, offset 0, flags [DF], length: 52) 149.156.195.60.22 > 149.156.99.122.1787: P [tcp sum ok] 338:350(12) ack 1004 win 24820
11:55:00.996939 IP (tos 0x0, ttl 128, id 19070, offset 0, flags [DF], length: 92) 149.156.99.122.1787 > 149.156.195.60.22: P 1004:1056(52) ack 350 win 65186
11:55:01.006165 IP (tos 0x0, ttl  62, id 46766, offset 0, flags [DF], length: 52) 149.156.195.60.22 > 149.156.99.122.1787: P [tcp sum ok] 350:362(12) ack 1056 win 24820
11:55:01.007311 IP (tos 0x0, ttl 128, id 19071, offset 0, flags [DF], length: 52) 149.156.99.122.1787 > 149.156.195.60.22: P [tcp sum ok] 1056:1068(12) ack 362 win 65174
11:55:01.021277 IP (tos 0x0, ttl  62, id 46767, offset 0, flags [DF], length: 116) 149.156.195.60.22 > 149.156.99.122.1787: P 362:438(76) ack 1068 win 24820
11:56:45.588318 IP (tos 0x0, ttl 253, id 24744, offset 0, flags [DF], length: 60) 149.156.96.21 > 149.156.99.122: icmp 40: echo reply seq 9984
11:56:46.582437 IP (tos 0x0, ttl 128, id 22317, offset 0, flags [none], length: 60) 149.156.99.122 > 149.156.96.21: icmp 40: echo request seq 10240
11:56:46.583053 IP (tos 0x0, ttl 253, id 24745, offset 0, flags [DF], length: 60) 149.156.96.21 > 149.156.99.122: icmp 40: echo reply seq 10240
11:56:47.582800 IP (tos 0x0, ttl 128, id 22346, offset 0, flags [none], length: 60) 149.156.99.122 > 149.156.96.21: icmp 40: echo request seq 10496
11:56:47.583421 IP (tos 0x0, ttl 253, id 24746, offset 0, flags [DF], length: 60) 149.156.96.21 > 149.156.99.122: icmp 40: echo reply seq 10496
11:56:48.582443 IP (tos 0x0, ttl 128, id 22375, offset 0, flags [none], length: 60) 149.156.99.122 > 149.156.96.21: icmp 40: echo request seq 10752
11:56:48.583028 IP (tos 0x0, ttl 253, id 24747, offset 0, flags [DF], length: 60) 149.156.96.21 > 149.156.99.122: icmp 40: echo reply seq 10752